{
  "contractVersion": "conclusion-vector/v1",
  "vectorId": "conclusion-vector:synthetic:bazi-shadow-p0-career-overview",
  "fixtureId": "synthetic:bazi-shadow-p0",
  "stateDigest": "sha256:5b8584863a5c42def08807318932dd159c7c0ad0506ef949ae8cb79a4ba2e3d5",
  "topic": "career",
  "lens": "overview",
  "claims": [
    {
      "claimId": "claim:synthetic:direct-root-structure",
      "type": "structural-tendency",
      "status": "grounded",
      "stateNodeIds": ["bazi.shadow.direct-roots", "bazi.shadow.strength-inputs"],
      "permittedPhrasing": "descriptive"
    }
  ],
  "limitations": ["synthetic:lab-only"]
}
